step,role,action,trigger_metric,trigger_condition,sla,evidence_type,evidence_description,evidence_path,timestamp
1,R(Operator),Freeze explanation cache and enforce seed/parameters,flip_rate/Jaccard,threshold_exceeded,24h,O,Explanation cache pinned; deterministic seed and parameters enforced,evidence/O_observed/xai/cache_pin_and_seed_enforcement.log,2025-01-12T10:12:08Z
2,R(Operator),Generate recent flip cases report,flip_rate/Jaccard,threshold_exceeded,24h,O,"Flip-case report created with examples, diffs, and affected segments",evidence/O_observed/xai/reports/flip_cases_report_2025-01-12.pdf,2025-01-12T11:48:27Z
3,A(PM),Triage root cause (decision: boundary/noise/XAI variance),flip_rate/Jaccard,incident_reported,72h,O,Root-cause triage decision documented with rationale and chosen hypothesis,evidence/O_observed/approvals/xai_root_cause_triage.md,2025-01-13T09:05:33Z
4,A(PM),Approve mitigation (increase smoothing or update explanation policy),flip_rate/Jaccard,root_cause_confirmed,72h,O,Mitigation approval record for smoothing/policy update,evidence/O_observed/approvals/xai_mitigation_approval.pdf,2025-01-13T16:22:11Z
5,Post-action,Verify explanation stability recovery,flip_rate/Jaccard,mitigation_applied,post-mitigation,O,Stability check results showing flip_rate/Jaccard back within guardband,evidence/O_observed/xai/stability_checks/xai_stability_check_2025-01-14.csv,2025-01-14T02:14:59Z
6,Post-action,Rollback temporary settings (unfreeze cache / relax enforced seed) if recovered,flip_rate/Jaccard,stability_recovered,immediate,O,Settings normalized after stability recovery,evidence/O_observed/xai/settings/normalize_after_recovery.log,2025-01-14T02:33:18Z
7,Post-action,If not recovered: restrict explanation display or keep human-review route,flip_rate/Jaccard,stability_not_recovered,immediate,A,Fallback policy for limiting explanations or enforcing HITL until recovery,evidence/A_assumed/xai/fallback_policy_explanation_limit_or_hitl.md,2025-01-14T02:33:18Z
